{
  "name": "node",
  "description": "Node.js runtime with TypeScript-oriented project defaults.",
  "language": "typescript",
  "packageManagers": ["npm", "pnpm", "yarn"],
  "directories": [
    "src",
    "tests"
  ],
  "requiredFiles": [
    "package.json"
  ],
  "commands": [
    "install: {{PACKAGE_MANAGER}} install",
    "test: {{PACKAGE_MANAGER}} test"
  ],
  "detect": {
    "files": ["package.json"]
  }
}
